{
    "$schema": "http://json-schema.org/draft-07/schema#",
    "title": "Apple OS",
    "description": "Description of an Apple operating system release",
    "$ref": "#/definitions/os",
    "type": "object",
    "required": ["osStr", "version"],
    "definitions": {
        "os": {
            "type": "object",
            "additionalProperties": false,
            "properties": {
                "osStr":         {"type": "string"},
                "version":       {"type": "string", "not": { "pattern": "FIXME" }},
                "iosVersion":    {"type": "string"},
                "safariVersion": {
                    "anyOf": [
                        {"type": "string"},
                        {"type": "array", "items": {"type": "string"}}
                    ]
                },
                "build":         {"type": "string"},
                "restoreVersion": {"type": "string"},
                "buildId":       {"type": "string", "format": "uuid"},
                "uniqueBuild":   {"type": "string"},
                "key":           {"type": "string"},
                
                "bridgeOSBuild":    {"type": "string"},
                "embeddedOSBuild":  {"type": "string"},
                "basebandVersions": {
                    "type":"object",
                    "additionalProperties": true
                },
                "buildTrain":    {
                    "anyOf": [
                        {"type": "string"},
                        {"type": "array", "items": {"type": "string"}}
                    ]
                },

                "released":     {"anyOf": [
                    {"type": "string", "format": "date-time"},
                    {"type": "string", "format": "date"},
                    {"type": "string", "pattern": "^\\d{4}-\\d{2}$"},
                    {"type": "string", "pattern": "^\\d{4}$"},
                    {"type": "string", "maxLength": 0}
                ]},
                "rc":           {"type": "boolean"},
                "beta":         {"type": "boolean"},
                "bsi":          {"type": "boolean"},
                "rsr":          {"type": "boolean"},
                "internal":     {"type": "boolean"},
                "hideFromLatestVersions": {"type": "boolean"},
                "notes":        {"type": "string"},
                "releaseNotes": {
                    "anyOf": [
                        {"type": "string", "format": "uri"},
                        {"$ref": "#/definitions/sourceLink"}
                    ]
                },
                "enterpriseNotes": {
                    "anyOf": [
                        {"type": "string", "format": "uri"},
                        {"$ref": "#/definitions/sourceLink"}
                    ]
                },
                "securityNotes": {
                    "anyOf": [
                        {"type": "null"},
                        {"type": "string", "format": "uri"},
                        {"$ref": "#/definitions/sourceLink"}
                    ]
                },

                "preinstalled": {
                    "anyOf": [
                        {"type": "boolean"},
                        {"type": "array", "items": {"type": "string"}}
                    ]
                },
                "preinstalledOS": {
                    "anyOf": [
                        {"type": "boolean"},
                        {"type": "array", "items": {"type": "string"}}
                    ]
                },
                "signed": {
                    "anyOf": [
                        {"type": "boolean"},
                        {"type": "array", "items": {"type": "string"}}
                    ]
                },
                "deviceMap": {
                    "type": "array",
                    "items": {"type": "string"},
                    "minItems": 1,
                    "uniqueItems": true
                },
                "osMap": {
                    "type": "array",
                    "items": {"type": "string"},
                    "minItems": 1,
                    "uniqueItems": true
                },
                "ipd": {
                    "type": "object",
                    "properties": {
                        "AudioAccessory": {
                            "anyOf": [
                                {"type": "string", "format": "uri"},
                                {"$ref": "#/definitions/sourceLink"}
                            ]
                        },
                        "AppleTV":  {
                            "anyOf": [
                                {"type": "string", "format": "uri"},
                                {"$ref": "#/definitions/sourceLink"}
                            ]
                        },
                        "iPhone":   {
                            "anyOf": [
                                {"type": "string", "format": "uri"},
                                {"$ref": "#/definitions/sourceLink"}
                            ]
                        },
                        "iPad":     {
                            "anyOf": [
                                {"type": "string", "format": "uri"},
                                {"$ref": "#/definitions/sourceLink"}
                            ]
                        },
                        "iPod":     {
                            "anyOf": [
                                {"type": "string", "format": "uri"},
                                {"$ref": "#/definitions/sourceLink"}
                            ]
                        }
                    },
                    "additionalProperties": {
                        "anyOf": [
                            {"type": "string", "format": "uri"},
                            {"$ref": "#/definitions/sourceLink"}
                        ]
                    }
                },
                "createDuplicateEntries": {
                    "type": "array",
                    "minItems": 1,
                    "items": {
                        "allOf": [
                            {"$ref": "#/definitions/os"},
                            {"type": "object", "properties": {"createDuplicateEntries": false}}
                        ]
                    }
                },
                "sdks": {
                    "type": "array",
                    "minItems": 1,
                    "items": {
                        "type": "object",
                        "additionalProperties": false,
                        "properties": {
                            "beta": {"type": "boolean"},
                            "build": {"type": "string"},
                            "buildId": {"type": "string", "format": "uuid"},
                            "osStr": {"type": "string"},
                            "rc": {"type": "boolean"},
                            "version": {"type": "string"}
                        }
                    }
                },
                "appledbWebImage": {
                    "type": "object",
                    "additionalProperties": false,
                    "properties": {
                        "id": {"type": "string"},
                        "align": {"type": "string"}
                    }
                },
                "appledbUrl": {"type": "string"},
                "sources": {
                    "type": "array",
                    "items": {
                        "type": "object",
                        "additionalProperties": false,
                        "required": ["type", "links", "deviceMap"],
                        "properties": {
                            "type": {"enum": ["ipsw", "ota", "update", "recovery", "sfr", "kdk", "installassistant", "combo", "pkg", "aar", "dmg", "exe", "appx", "apk", "xip", "tar", "bin", "ipa", "xpi", "msi", "zip", "smi"]},
                            "arch": {
                                "type": "array",
                                "minItems": 1,
                                "items": {"type": "string"},
                                "uniqueItems": true
                            },
                            "deviceMap": {"$ref": "#/definitions/os/properties/deviceMap"},
                            "boardMap": {
                                "type": "array",
                                "minItems": 1,
                                "items": {"type": "string"},
                                "uniqueItems": true
                            },
                            "osMap": {"$ref": "#/definitions/os/properties/osMap"},
                            "skipUpdateLinks": {"type": "boolean"},
                            "windowsUpdateDetails": {
                                "type": "object",
                                "additionalProperties": false,
                                "properties": {
                                    "updateId": {"type": "string", "format": "uuid"},
                                    "revisionId": {"type": "string", "pattern": "^\\w+$"}
                                }
                            },
                            "hashes": {
                                "type": "object",
                                "additionalProperties": false,
                                "properties": {
                                    "md5":      { "type": "string", "pattern": "^[0-9a-f]{32}$" },
                                    "sha1":     { "type": "string", "pattern": "^[0-9a-f]{40}$" },
                                    "sha2-256": { "type": "string", "pattern": "^[0-9a-f]{64}$" },
                                    "sha2-512": { "type": "string", "pattern": "^[0-9a-f]{128}$" }
                                }
                            },
                            "links": {
                                "type": "array",
                                "minItems": 1,
                                "items": {
                                    "$ref": "#/definitions/sourceLink"
                                }
                            },
                            "prerequisiteBuild": {
                                "anyOf": [
                                    {"type": "string"},
                                    {"type": "array", "minItems": 1, "items": {"type": "string"}}
                                ]
                            },
                            "systemImageId": {"type": "string", "format": "uuid"},
                            "size": {"type": "integer"}
                        }
                    }
                }
            }
        },
        "sourceLink": {
            "type": "object",
            "additionalProperties": false,
            "required": ["url", "active"],
            "properties": {
                "url": {"type": "string", "format": "uri"},
                "decryptionKey": {"type": "string"},
                "active": {"type": "boolean"},
                "catalog": {"enum": ["dev-beta", "public-beta"]}
            }
        }
    }
}
