{
    "osStr": "Boot Camp ESD",
    "version": "1.0.0.0.1.1306847324",
    "uniqueBuild": "041-89072",
    "notes": "Windows Support Software for: MacBookPro14,3",
    "deviceMap": [
        "Boot Camp"
    ],
    "sources": [
        {
            "type": "pkg",
            "deviceMap": [
                "Boot Camp"
            ],
            "links": [
                {
                    "url": "https://swcdn.apple.com/content/downloads/47/29/041-89072-A_HZY5QI4LGV/knck1r3qmsw9nliisjjm7vll0zv1u239eu/BootCampESD.pkg",
                    "active": true
                }
            ],
            "size": 809731463
        }
    ],
    "released": "2019-10-14"
}
