{
    "osStr": "visionOS",
    "version": "2.0 beta 3",
    "build": "22N5277g",
    "restoreVersion": "22.14.277.5.7,0",
    "buildId": "3DE3F8E8-3A77-11EF-9541-E9195F52984A",
    "buildTrain": "ConstellationSeed",
    "released": "2024-07-08",
    "beta": true,
    "appledbWebImage": {
        "id": "visionos2",
        "align": "left"
    },
    "deviceMap": [
        "RealityDevice14,1"
    ],
    "sources": [
        {
            "type": "ipsw",
            "deviceMap": [
                "RealityDevice14,1"
            ],
            "links": [
                {
                    "url": "https://updates.cdn-apple.com/2024SummerSeed/fullrestores/062-23675/5ABEAC80-17C5-4D12-9932-A39D70719A38/Apple_Vision_Pro_2.0_22N5277g_Restore.ipsw",
                    "active": true
                }
            ],
            "hashes": {
                "sha1": "30a93b58850d3b41166ef9604fc132b209bc0354",
                "sha2-256": "4268722827148da22e637aaaa8d8a18315589a37d955244e7f04669d289605fe"
            },
            "size": 10168770244
        },
        {
            "type": "ota",
            "systemImageId": "80A98480-61DD-4EDF-98DC-1AD9E098540D",
            "deviceMap": [
                "RealityDevice14,1"
            ],
            "links": [
                {
                    "url": "https://updates.cdn-apple.com/2024SummerSeed/mobileassets/062-23674/17DCF925-2B95-4AAF-8EFD-D1E2C02A782E/com_apple_MobileAsset_SoftwareUpdate/a32a88ad0a96281c9fbf5e645b2c0345f60d01cfcebf06cdd703dc0a72dc7bbf.aea",
                    "decryptionKey": "Wp+qowafmYWVwmmT1tfaoodZmLNXa3pAaXgrmSemQcY=",
                    "active": true
                }
            ],
            "hashes": {
                "sha1": "d5419e2bf83f940749906b83afd2f4f708fdeb29",
                "sha2-256": "c345f103626ca466266cd2827e40a4288827de84bca07d46bfe58819c8272fdc"
            },
            "size": 8321499136
        },
        {
            "type": "ota",
            "prerequisiteBuild": "21O5761a",
            "deviceMap": [
                "RealityDevice14,1"
            ],
            "links": [
                {
                    "url": "https://updates.cdn-apple.com/2024SummerSeed/mobileassets/062-32225/B4EDA1C9-74C9-4098-B6F5-F5A624E190C0/com_apple_MobileAsset_SoftwareUpdate/acc92293f642a8a9c40276d0cb9338621ef27068ff77a8f5d48a7e25bfa5e79d.aea",
                    "decryptionKey": "Wa9FNYdY6GPfbXVyd8o9IJRalthDlX9WR1dtQddUSVY=",
                    "active": true
                }
            ],
            "hashes": {
                "sha1": "a9d574b2c052aa6072f20488d463c62c53aea0ba",
                "sha2-256": "69103455857f57d91e4420924d378c2a343fbf7983262d2f2ccdf64c683d6d49"
            },
            "size": 3623878656
        },
        {
            "type": "ota",
            "prerequisiteBuild": "22N5267g",
            "deviceMap": [
                "RealityDevice14,1"
            ],
            "links": [
                {
                    "url": "https://updates.cdn-apple.com/2024SummerSeed/mobileassets/062-23672/0DF3617F-E470-4E25-924D-D1BFB8551D69/com_apple_MobileAsset_SoftwareUpdate/93490e4647ae99821c6e5fc3ed99ab2ccefbb7e19a1b3fbbf14bc905dacf5a4a.aea",
                    "decryptionKey": "kggXr4tJGFCvHAZgBmDhtgf5N+RdXzc7NT/QvdeHh5w=",
                    "active": true
                }
            ],
            "hashes": {
                "sha1": "ed136af968bf6abc4f551f98cd26821cba5ceb44",
                "sha2-256": "45e53651a8a57f115e51e9d87e6cc459868d31a92e562d3d849d51028321ab4d"
            },
            "size": 989855744
        },
        {
            "type": "recovery",
            "systemImageId": "F761C022-C467-457C-88B4-5E5C1054F7B3",
            "deviceMap": [
                "RealityDevice14,1"
            ],
            "links": [
                {
                    "url": "https://updates.cdn-apple.com/2024SummerSeed/patches/062-23673/3C27A053-CE26-4077-BCBB-B59A8F49C955/com_apple_MobileAsset_RecoveryOSUpdate/bb00ba6ccebe0755761eafa447ac68f803c91e5c.zip",
                    "active": true
                }
            ],
            "hashes": {
                "sha1": "cf404dc8ca3cf53fea850b11bc851f8c091eed6d",
                "sha2-256": "feb157d9c8a9a9a32bbaeb9035394133158707fb4ab5c6623b2d0739366d684f"
            },
            "size": 196424171
        }
    ]
}