{
    "osStr": "OS X",
    "version": "10.8.4 (Security Update 2013-003)",
    "build": "12E1009",
    "released": "2013-07-02",
    "releaseNotes": {
        "url": "https://support.apple.com/kb/DL1667",
        "active": false
    },
    "securityNotes": "https://support.apple.com/HT201366",
    "appledbWebImage": {
        "id": "Mountain Lion",
        "align": "left"
    },
    "deviceMap": [
        "iMac7,1-20-inch",
        "iMac7,1-24-inch",
        "iMac8,1-20-inch",
        "iMac8,1-24-inch",
        "iMac9,1-20-inch-Early-2009",
        "iMac9,1-20-inch-Mid-2009",
        "iMac9,1-24-inch",
        "iMac10,1-21.5-inch",
        "iMac10,1-27-inch",
        "iMac11,1",
        "iMac11,2",
        "iMac11,3",
        "iMac12,1-Late-2011",
        "iMac12,1-Mid-2011",
        "iMac12,2",
        "iMac13,1",
        "iMac13,2",
        "iMac13,3",
        "MacBook5,1",
        "MacBook5,2-Early-2009",
        "MacBook5,2-Mid-2009",
        "MacBook6,1",
        "MacBook7,1",
        "MacBookAir2,1-2008",
        "MacBookAir2,1-2009",
        "MacBookAir3,1",
        "MacBookAir3,2",
        "MacBookAir4,1",
        "MacBookAir4,2",
        "MacBookAir5,1",
        "MacBookAir5,2",
        "MacBookPro3,1-15-inch-Late-2007",
        "MacBookPro3,1-15-inch-Mid-2007",
        "MacBookPro3,1-17-inch-Late-2007",
        "MacBookPro3,1-17-inch-Mid-2007",
        "MacBookPro4,1-15-inch",
        "MacBookPro4,1-17-inch",
        "MacBookPro5,1-2008",
        "MacBookPro5,1-2009",
        "MacBookPro5,2-Early-2009",
        "MacBookPro5,2-Mid-2009",
        "MacBookPro5,3",
        "MacBookPro5,4",
        "MacBookPro5,5",
        "MacBookPro6,1",
        "MacBookPro6,2",
        "MacBookPro7,1",
        "MacBookPro8,1-Early-2011",
        "MacBookPro8,1-Late-2011",
        "MacBookPro8,2-Early-2011",
        "MacBookPro8,2-Late-2011",
        "MacBookPro8,3-Early-2011",
        "MacBookPro8,3-Late-2011",
        "MacBookPro9,1",
        "MacBookPro9,2",
        "MacBookPro10,1-Early-2013",
        "MacBookPro10,1-Mid-2012",
        "MacBookPro10,2-Early-2013",
        "MacBookPro10,2-Late-2012",
        "Macmini3,1-Early-2009",
        "Macmini3,1-Late-2009",
        "Macmini4,1",
        "Macmini5,1",
        "Macmini5,2",
        "Macmini5,3",
        "Macmini6,1",
        "Macmini6,2",
        "MacPro3,1",
        "MacPro4,1",
        "MacPro5,1-2010",
        "MacPro5,1-2012",
        "MacPro5,1-Server-2010",
        "MacPro5,1-Server-2012",
        "Xserve3,1"
    ],
    "sources": [
        {
            "type": "update",
            "deviceMap": [
                "iMac7,1-20-inch",
                "iMac7,1-24-inch",
                "iMac8,1-20-inch",
                "iMac8,1-24-inch",
                "iMac9,1-20-inch-Early-2009",
                "iMac9,1-20-inch-Mid-2009",
                "iMac9,1-24-inch",
                "iMac10,1-21.5-inch",
                "iMac10,1-27-inch",
                "iMac11,1",
                "iMac11,2",
                "iMac11,3",
                "iMac12,1-Late-2011",
                "iMac12,1-Mid-2011",
                "iMac12,2",
                "iMac13,1",
                "iMac13,2",
                "iMac13,3",
                "MacBook5,1",
                "MacBook5,2-Early-2009",
                "MacBook5,2-Mid-2009",
                "MacBook6,1",
                "MacBook7,1",
                "MacBookAir2,1-2008",
                "MacBookAir2,1-2009",
                "MacBookAir3,1",
                "MacBookAir3,2",
                "MacBookAir4,1",
                "MacBookAir4,2",
                "MacBookAir5,1",
                "MacBookAir5,2",
                "MacBookPro3,1-15-inch-Late-2007",
                "MacBookPro3,1-15-inch-Mid-2007",
                "MacBookPro3,1-17-inch-Late-2007",
                "MacBookPro3,1-17-inch-Mid-2007",
                "MacBookPro4,1-15-inch",
                "MacBookPro4,1-17-inch",
                "MacBookPro5,1-2008",
                "MacBookPro5,1-2009",
                "MacBookPro5,2-Early-2009",
                "MacBookPro5,2-Mid-2009",
                "MacBookPro5,3",
                "MacBookPro5,4",
                "MacBookPro5,5",
                "MacBookPro6,1",
                "MacBookPro6,2",
                "MacBookPro7,1",
                "MacBookPro8,1-Early-2011",
                "MacBookPro8,1-Late-2011",
                "MacBookPro8,2-Early-2011",
                "MacBookPro8,2-Late-2011",
                "MacBookPro8,3-Early-2011",
                "MacBookPro8,3-Late-2011",
                "MacBookPro9,1",
                "MacBookPro9,2",
                "MacBookPro10,1-Early-2013",
                "MacBookPro10,1-Mid-2012",
                "MacBookPro10,2-Early-2013",
                "MacBookPro10,2-Late-2012",
                "Macmini3,1-Early-2009",
                "Macmini3,1-Late-2009",
                "Macmini4,1",
                "Macmini5,1",
                "Macmini5,2",
                "Macmini5,3",
                "Macmini6,1",
                "Macmini6,2",
                "MacPro3,1",
                "MacPro4,1",
                "MacPro5,1-2010",
                "MacPro5,1-2012",
                "MacPro5,1-Server-2010",
                "MacPro5,1-Server-2012",
                "Xserve3,1"
            ],
            "links": [
                {
                    "url": "https://updates.cdn-apple.com/2019/cert/041-88062-20191011-f57464ba-0b7b-4afc-8057-17cc54b10d86/SecUpd2013-003.dmg",
                    "active": true
                }
            ],
            "hashes": {
                "md5": "671557b5f9ccdea2ebe5ff49c3beaf16"
            },
            "size": 20383112
        }
    ]
}