{
    "osStr": "bridgeOS",
    "version": "6.4",
    "build": "19P4243",
    "restoreVersion": "19.16.14243.0.0,0",
    "buildId": "253CEFC8-A697-11EC-9EC6-EA009B2E3A12",
    "buildTrain": "StarBridgeE",
    "released": "2022-03-31",
    "deviceMap": [
        "iBridge2,1",
        "iBridge2,3",
        "iBridge2,4",
        "iBridge2,5",
        "iBridge2,6",
        "iBridge2,7",
        "iBridge2,8",
        "iBridge2,10",
        "iBridge2,12",
        "iBridge2,14",
        "iBridge2,15",
        "iBridge2,16",
        "iBridge2,19",
        "iBridge2,20",
        "iBridge2,21",
        "iBridge2,22"
    ],
    "sources": [
        {
            "type": "ipsw",
            "systemImageId": "27BF9417-D1FD-4A9D-A830-1C870B1BAB9F",
            "deviceMap": [
                "iBridge2,1",
                "iBridge2,3",
                "iBridge2,4",
                "iBridge2,5",
                "iBridge2,6",
                "iBridge2,7",
                "iBridge2,8",
                "iBridge2,10",
                "iBridge2,12",
                "iBridge2,14",
                "iBridge2,15",
                "iBridge2,16",
                "iBridge2,19",
                "iBridge2,20",
                "iBridge2,21",
                "iBridge2,22"
            ],
            "links": [
                {
                    "url": "https://updates.cdn-apple.com/2022SpringFCS/fullrestores/002-82670/A85D86CB-3DB5-4159-8F58-EA9D589F4849/iBridge2,1,iBridge2,10,iBridge2,12,iBridge2,14,iBridge2,15,iBridge2,16,iBridge2,19,iBridge2,20,iBridge2,21,iBridge2,22,iBridge2,3,iBridge2,4,iBridge2,5,iBridge2,6,iBridge2,7,iBridge2,8_6.4_19P4243_Restore.ipsw",
                    "active": true
                }
            ],
            "hashes": {
                "md5": "70db1c9154851619c1a8012e87e0238a",
                "sha1": "09f169e65d8f7650d10bdff3501354f06efe2b9e",
                "sha2-256": "6d8ed4c65db87febe6ff9146e16b886124fbaadb8833d753140d82cf447d4a7c"
            },
            "size": 629550682
        },
        {
            "type": "pkg",
            "deviceMap": [
                "iBridge2,1",
                "iBridge2,3",
                "iBridge2,4",
                "iBridge2,5",
                "iBridge2,6",
                "iBridge2,7",
                "iBridge2,8",
                "iBridge2,10",
                "iBridge2,12",
                "iBridge2,14",
                "iBridge2,15",
                "iBridge2,16",
                "iBridge2,19",
                "iBridge2,20",
                "iBridge2,21",
                "iBridge2,22"
            ],
            "links": [
                {
                    "url": "https://swcdn.apple.com/content/downloads/52/32/002-79221-A_ODVCIPEQ8Z/pm6npz56lk7dckhfz7ejmnok8mok2ianug/BridgeOSUpdateCustomer.pkg",
                    "active": false
                }
            ],
            "size": 490890302
        }
    ]
}