{
    "osStr": "cloudOS",
    "version": "18.1",
    "build": "22B15045c",
    "restoreVersion": "22.2.04.5.3,115",
    "released": "2024-09-23",
    "deviceMap": [
        "ComputeModule14,1"
    ],
    "sources": [
        {
            "type": "ipsw",
            "deviceMap": [
                "ComputeModule14,1"
            ],
            "links": [
                {
                    "url": "https://updates.cdn-apple.com/private-cloud-compute/69fd2c17ad0c8b94ce50dcd5737ecccedbee266311906aaeb11dbffd75d38408",
                    "active": false
                }
            ],
            "hashes": {
                "sha2-256": "69fd2c17ad0c8b94ce50dcd5737ecccedbee266311906aaeb11dbffd75d38408"
            }
        }
    ]
}