{
    "osStr": "visionOS",
    "version": "27.0 beta 2 Simulator",
    "build": "24M5306g",
    "buildId": "8F9DF082-6AF2-11F1-BC8B-913CE4D00F1B",
    "uniqueBuild": "24M5306g-sim",
    "released": "2026-06-22",
    "beta": true,
    "deviceMap": [
        "visionOS Simulator"
    ],
    "sources": [
        {
            "type": "aar",
            "arch": [
                "arm64"
            ],
            "systemImageId": "8553F132-C3FB-4DCA-A6E5-9AAADBF4861A",
            "deviceMap": [
                "visionOS Simulator"
            ],
            "links": [
                {
                    "url": "https://updates.cdn-apple.com/MobileAssets2026/mobileassets/141-34199/2C789411-32AF-42EF-B2AA-D1526FEABC65/com_apple_MobileAsset_xrOSSimulatorRuntime/73624D45-7C67-4A86-BB79-6AF63C358FD8.aar",
                    "decryptionKey": "AT7WauBXyWl6VJPlKSx0tLdmX85blJD2l3UjdcIEJJ0=",
                    "active": true
                }
            ],
            "hashes": {
                "sha1": "3852206f2581d51eac1353736b72b35cb2dc0659",
                "sha2-256": "5ee8110a6bf1977e581e12f2edb76c02f940961bc993a5bd111fdfc4e413d36c"
            },
            "size": 7851737088
        }
    ]
}