{
    "osStr": "bridgeOS",
    "version": "3.2 beta 3",
    "build": "16P52540a",
    "restoreVersion": "16.16.2540.5.1,0",
    "buildId": "7837AFD4-E709-11E8-9FAF-E0B07D830EEE",
    "buildTrain": "bridgeOSLibertyCSeed",
    "released": "2018-11-15",
    "beta": true,
    "deviceMap": [
        "iBridge2,1",
        "iBridge2,3",
        "iBridge2,4",
        "iBridge2,5",
        "iBridge2,7",
        "iBridge2,8"
    ],
    "sources": [
        {
            "type": "pkg",
            "systemImageId": "8947FB3E-7421-4BE2-BD0C-5F251FC14E5E",
            "deviceMap": [
                "iBridge2,1",
                "iBridge2,3",
                "iBridge2,4",
                "iBridge2,5",
                "iBridge2,7",
                "iBridge2,8"
            ],
            "links": [
                {
                    "url": "https://swcdn.apple.com/content/downloads/17/29/041-24617/hdodx9ze4j4gkxsozxdtmd5ppeuivguuy3/BridgeOSUpdateCustomer.pkg",
                    "active": false
                }
            ],
            "size": 323947813
        },
        {
            "type": "pkg",
            "deviceMap": [
                "iBridge2,1",
                "iBridge2,3",
                "iBridge2,4",
                "iBridge2,5",
                "iBridge2,7",
                "iBridge2,8"
            ],
            "links": [
                {
                    "url": "https://swcdn.apple.com/content/downloads/22/41/041-25636/mw0ttqc350yaoi4tll06518l6jymicvbt0/BridgeOSUpdateCustomer.pkg",
                    "active": false
                }
            ],
            "size": 323947821
        }
    ]
}