{
    "osStr": "Apple Devices",
    "version": "1.1030.20993.0",
    "released": "2024-03-28",
    "deviceMap": [
        "Apple Devices"
    ],
    "sources": [
        {
            "type": "appx",
            "deviceMap": [
                "Apple Devices"
            ],
            "windowsUpdateDetails": {
                "updateId": "6a1ef620-5590-425e-9b33-e8945f9ecf4e",
                "revisionId": "1"
            },
            "links": [
                {
                    "url": "https://apps.microsoft.com/store/detail/9NP83LWLPZ9K",
                    "active": true
                }
            ],
            "hashes": {
                "sha1": "b165191dd5e337259e77b162b27ebeed86d8f9a4",
                "sha2-256": "eaa44b7cca00647bd54f04a9e928941956d3efedbeba02f82590b3fbfc738011"
            },
            "size": 224001769
        }
    ]
}