{
    "osStr": "bridgeOS",
    "version": "5.0.1 beta",
    "build": "18P52551s",
    "released": "2020-10-28",
    "beta": true,
    "deviceMap": [
        "iBridge2,1",
        "iBridge2,3",
        "iBridge2,4",
        "iBridge2,5",
        "iBridge2,6",
        "iBridge2,7",
        "iBridge2,8",
        "iBridge2,10",
        "iBridge2,12",
        "iBridge2,14",
        "iBridge2,15",
        "iBridge2,16",
        "iBridge2,19",
        "iBridge2,20",
        "iBridge2,21",
        "iBridge2,22"
    ],
    "sources": [
        {
            "type": "pkg",
            "deviceMap": [
                "iBridge2,1",
                "iBridge2,3",
                "iBridge2,4",
                "iBridge2,5",
                "iBridge2,6",
                "iBridge2,7",
                "iBridge2,8",
                "iBridge2,10",
                "iBridge2,12",
                "iBridge2,14",
                "iBridge2,15",
                "iBridge2,16",
                "iBridge2,19",
                "iBridge2,20",
                "iBridge2,21",
                "iBridge2,22"
            ],
            "links": [
                {
                    "url": "http://swcdn.apple.com/content/downloads/16/13/001-58877-A_39XMCAVLFG/0dygc5fjj52xaox8r7c6n6niup2fe24a3y/BridgeOSUpdateCustomer.pkg",
                    "active": false
                }
            ],
            "size": 441765045
        }
    ]
}