{
    "osStr": "Safari",
    "version": "4.0.2",
    "released": "2009-07-08",
    "securityNotes": "https://support.apple.com/HT3666",
    "deviceMap": [
        "Safari (Windows)",
        "Safari (macOS)"
    ],
    "osMap": [
        "Mac OS X 10.4",
        "Mac OS X 10.5",
        "Windows XP",
        "Windows Vista",
        "Windows 7"
    ],
    "sources": [
        {
            "type": "exe",
            "deviceMap": [
                "Safari (Windows)"
            ],
            "osMap": [
                "Windows XP",
                "Windows Vista",
                "Windows 7"
            ],
            "links": [
                {
                    "url": "http://appldnld.apple.com/Safari4/061-6759.20090708.Lki98/SafariSetup.exe",
                    "active": true
                }
            ],
            "hashes": {
                "md5": "2e74dc2c47d414f9f34d845965d7f6da"
            },
            "size": 28464416
        },
        {
            "type": "dmg",
            "deviceMap": [
                "Safari (macOS)"
            ],
            "osMap": [
                "Mac OS X 10.5"
            ],
            "links": [
                {
                    "url": "http://appldnld.apple.com/Safari4/061-6761.20090708.AsxpI/Safari4.0.2Leo.dmg",
                    "active": true
                }
            ],
            "hashes": {
                "md5": "93d5a350d96bb0949039d35b415c0ccb"
            },
            "size": 41908858
        }
    ]
}