{
    "osStr": "Rosetta",
    "version": "27.2 beta 3",
    "build": "26B5101f",
    "released": "2026-10-05",
    "beta": true,
    "deviceMap": [
        "Rosetta"
    ],
    "sources": [
        {
            "type": "pkg",
            "deviceMap": [
                "Rosetta"
            ],
            "links": [
                {
                    "url": "https://swcdn.apple.com/content/downloads/40/17/142-35644-A_OF3A3JS9H8/sshhkqm294so85g8fx4j4b55zn96ucc971/RosettaUpdateAuto.pkg",
                    "active": true
                }
            ],
            "hashes": {
                "sha1": "a8ce20f0607cc11243a89daecc7bcd5400c47a22"
            },
            "size": 248723
        }
    ]
}