{
    "osStr": "QuickTime",
    "version": "7.6.8",
    "released": "2010-09-15",
    "securityNotes": "http://support.apple.com/kb/HT4339",
    "deviceMap": [
        "QuickTime (Windows)"
    ],
    "osMap": [
        "Windows XP SP2",
        "Windows Vista",
        "Windows 7"
    ],
    "sources": [
        {
            "type": "exe",
            "deviceMap": [
                "QuickTime (Windows)"
            ],
            "osMap": [
                "Windows XP SP2",
                "Windows Vista",
                "Windows 7"
            ],
            "links": [
                {
                    "url": "http://appldnld.apple.com/QuickTime/061-8938.20100915.Qts3T/QuickTimeInstaller.exe",
                    "active": true
                }
            ]
        }
    ]
}