{
    "osStr": "Safari Technology Preview",
    "version": "36",
    "safariVersion": "11.0",
    "released": "2017-07-26",
    "beta": true,
    "releaseNotes": "https://developer.apple.com/documentation/safari-technology-preview-release-notes/stp-release-36",
    "deviceMap": [
        "Safari Technology Preview"
    ],
    "osMap": [
        "macOS 10.12",
        "macOS 10.13"
    ],
    "sources": [
        {
            "type": "dmg",
            "deviceMap": [
                "Safari Technology Preview"
            ],
            "osMap": [
                "macOS 10.12"
            ],
            "links": [
                {
                    "url": "https://secure-appldnld.apple.com/STP/091-23520-20170726-AC590232-714D-11E7-958D-19D4484DD6D5/SafariTechnologyPreview.dmg",
                    "active": true
                }
            ],
            "hashes": {
                "md5": "19a04bdfb18e4cde87022bec0825797c",
                "sha1": "0db7654283aaf59027731d0104e03923e6ada388",
                "sha2-256": "cc3aae7d80ede050c50addc73cbbc7bab8a4a95787fb8bf29c73aa801f1d771d"
            },
            "size": 68984219
        },
        {
            "type": "dmg",
            "deviceMap": [
                "Safari Technology Preview"
            ],
            "osMap": [
                "macOS 10.13"
            ],
            "links": [
                {
                    "url": "https://secure-appldnld.apple.com/STP/091-23518-20170726-AC590278-714D-11E7-958D-1AD4484DD6D5/SafariTechnologyPreview.dmg",
                    "active": true
                }
            ],
            "hashes": {
                "md5": "80d2e4abb9f4ce6c02444719f8c71c63",
                "sha1": "dbd1cae77c80752ba546bc921e0bfe00dbeed78f",
                "sha2-256": "9db2bb7740614d37f27c828f8bbd818e07d49de33fe79cbc4c0a68b96c7945b5"
            },
            "size": 68873635
        }
    ]
}