{
    "osStr": "OS X",
    "version": "10.10.3",
    "build": "14D2134",
    "buildTrain": "SUSyrahDomeHW",
    "released": "2015-04-16",
    "preinstalled": true,
    "appledbWebImage": {
        "id": "Yosemite",
        "align": "left"
    },
    "deviceMap": [
        "MacBookPro11,4",
        "MacBookPro11,5"
    ]
}