{
    "osStr": "Rosetta",
    "version": "15.8.2",
    "build": "24H232",
    "released": "2026-10-26",
    "deviceMap": [
        "Rosetta"
    ],
    "sources": [
        {
            "type": "pkg",
            "deviceMap": [
                "Rosetta"
            ],
            "links": [
                {
                    "url": "https://swcdn.apple.com/content/downloads/30/59/142-50014-A_UYDNMT6JL0/i9up0ouxzbav9sact2pijsgm2yaf71y2nl/RosettaUpdateAuto.pkg",
                    "active": true
                }
            ],
            "hashes": {
                "sha1": "45fbab7d8de72de5fe71b4a422daa15510e95353"
            },
            "size": 451524
        }
    ]
}