{
    "osStr": "Safari",
    "version": "16.3 beta 3",
    "build": "614D19",
    "released": "2023-01-18",
    "beta": true,
    "deviceMap": [
        "Safari (macOS)"
    ],
    "osMap": [
        "macOS 11"
    ],
    "sources": [
        {
            "type": "pkg",
            "deviceMap": [
                "Safari (macOS)"
            ],
            "osMap": [
                "macOS 11"
            ],
            "links": [
                {
                    "url": "http://swcdn.apple.com/content/downloads/49/20/032-35628-A_8UVCSDLEYN/dd389xfepd6uutlenj6gdsglhmm1c618ff/Safari16.3BigSurAutoSeed.pkg",
                    "active": false
                }
            ],
            "size": 128502643
        }
    ]
}