{
    "osStr": "tvOS",
    "version": "9.2.1 beta",
    "build": "13Y5752a",
    "buildTrain": "FernSeed",
    "released": "2016-04-06",
    "beta": true,
    "deviceMap": [
        "AppleTV5,3"
    ],
    "sources": [
        {
            "type": "ipsw",
            "deviceMap": [
                "AppleTV5,3"
            ],
            "links": [
                {
                    "url": "https://developer.apple.com/services-account/download?path=/iOS/tvOS_9.2.1_beta_Restore_Image/AppleTV53_9.2.1_13Y5752a_Restore.ipsw",
                    "active": false
                }
            ],
            "size": 1145053486
        },
        {
            "type": "ota",
            "deviceMap": [
                "AppleTV5,3"
            ],
            "links": [
                {
                    "url": "http://appldnld.apple.com/tvosseeds/031-56520-20160406-7D09A73C-FAC2-11E5-BD98-BAE2016A2A1A/com_apple_MobileAsset_SoftwareUpdate/1e9069bef79ee17ad74f5ec3836b1a5914f63413.zip",
                    "active": true
                }
            ],
            "hashes": {
                "md5": "5b9728c163d71d73d78bb717878a1e93"
            },
            "size": 855495243
        }
    ]
}