{
    "osStr": "Safari",
    "version": "26.0 beta 6",
    "build": "622A69",
    "buildTrain": "SafariCheerSequoia",
    "released": "2025-09-02",
    "beta": true,
    "releaseNotes": {
        "url": "https://developer.apple.com/services-account/download?path=/Safari/Safari_26.0_for_macOS_Sonoma_and_Safari_26.0_for_macOS_Sequoia_beta_6/Safari_26.0_Beta_6_Notes.pdf",
        "active": false
    },
    "deviceMap": [
        "Safari (macOS)"
    ],
    "osMap": [
        "macOS 15"
    ],
    "sources": [
        {
            "type": "dmg",
            "deviceMap": [
                "Safari (macOS)"
            ],
            "osMap": [
                "macOS 15"
            ],
            "links": [
                {
                    "url": "https://developer.apple.com/services-account/download?path=/Safari/Safari_26.0_for_macOS_Sonoma_and_Safari_26.0_for_macOS_Sequoia_beta_6/Safari_26.0_for_macOS_Sequoia_beta_6.dmg",
                    "active": false
                }
            ],
            "size": 225401695
        },
        {
            "type": "pkg",
            "deviceMap": [
                "Safari (macOS)"
            ],
            "osMap": [
                "macOS 15"
            ],
            "links": [
                {
                    "url": "https://swcdn.apple.com/content/downloads/52/20/093-30896-A_YEJI61SEPT/a9h2hjf8ynvcapy4qkxg1hdanmdlf25w28/Safari26.0SequoiaAutoSeed.pkg",
                    "active": false
                }
            ],
            "hashes": {
                "md5": "dc3861ac4d9ca48563f5a92d1cb0d58d",
                "sha1": "586b5f0d612853cd9bf32fa40b514d259ff2b32a",
                "sha2-256": "3c2be3a1db07166c9251ed8ca17cbb5348d105f85dbf2e71dbaf20897d58d808"
            },
            "size": 225710640
        }
    ]
}