{
    "osStr": "watchOS",
    "version": "9.1 Simulator",
    "build": "20S75",
    "buildId": "5BB16920-49FE-11ED-8FA8-A42D29C4FC2C",
    "uniqueBuild": "20S75-sim",
    "released": "2022-10-24",
    "createDuplicateEntries": [
        {
            "version": "9.1 RC Simulator",
            "uniqueBuild": "20S75-RC-sim",
            "released": "2022-10-18",
            "rc": true,
            "sources": [
                {
                    "type": "dmg",
                    "deviceMap": [
                        "watchOS Simulator"
                    ],
                    "links": [
                        {
                            "url": "https://developer.apple.com/services-account/download?path=/Developer_Tools/watchOS_9.1_Simulator_Runtime_Release_Candidate/watchOS_9.1_Simulator_Runtime_Release_Candidate.dmg",
                            "active": true
                        }
                    ],
                    "size": 3627381860
                }
            ]
        }
    ],
    "deviceMap": [
        "watchOS Simulator"
    ],
    "sources": [
        {
            "type": "dmg",
            "deviceMap": [
                "watchOS Simulator"
            ],
            "links": [
                {
                    "url": "https://developer.apple.com/services-account/download?path=/Developer_Tools/watchOS_9.1_Simulator_Runtime/watchOS_9.1_Simulator_Runtime.dmg",
                    "active": true
                }
            ],
            "size": 3627381860
        }
    ]
}