{
    "osStr": "visionOS",
    "version": "26.1 Simulator",
    "build": "23N47",
    "buildId": "AAA31D80-B09E-11F0-A4A5-D99BBE9904DE",
    "uniqueBuild": "23N47-sim",
    "released": "2025-11-03",
    "createDuplicateEntries": [
        {
            "version": "26.1 RC Simulator",
            "uniqueBuild": "23N47-RC-sim",
            "released": "2025-10-28",
            "rc": true
        }
    ],
    "deviceMap": [
        "visionOS Simulator"
    ],
    "sources": [
        {
            "type": "aar",
            "arch": [
                "arm64",
                "x86_64"
            ],
            "systemImageId": "2E54ADF9-2552-4424-B9DE-70ACA6A731B8",
            "deviceMap": [
                "visionOS Simulator"
            ],
            "links": [
                {
                    "url": "https://updates.cdn-apple.com/2025/mobileassets/043-52972/E04B1891-4176-425D-B166-73B2C17954A1/com_apple_MobileAsset_xrOSSimulatorRuntime/C89DFB4A-237E-4F99-AEF3-1C329F089EDF.aar",
                    "decryptionKey": "STa2dlVMIf2jloDiTyG63A43ni0n1EKgFcfvYLcUMvk=",
                    "active": true
                }
            ],
            "hashes": {
                "sha1": "36d448112d520cc894e0de2d48a3a6dde7a22781",
                "sha2-256": "e3f3ed73844dd9c5a9ed6084769f969f0b63a05a738ca08587fe1c8226229a82"
            },
            "size": 9126805504
        },
        {
            "type": "aar",
            "arch": [
                "arm64"
            ],
            "systemImageId": "B6EEEE14-082B-4A88-AE85-77F6C266581C",
            "deviceMap": [
                "visionOS Simulator"
            ],
            "links": [
                {
                    "url": "https://updates.cdn-apple.com/2025/mobileassets/043-52973/95746843-4683-451D-9173-273ABC63B794/com_apple_MobileAsset_xrOSSimulatorRuntime/7F705F5A-6E47-4EEA-ABB9-E0B953E6F5DF.aar",
                    "decryptionKey": "80J/2BO2hWPNODxLzEJP3ROhOutqhkhn7SRDVGqtJ8o=",
                    "active": true
                }
            ],
            "hashes": {
                "sha1": "9d25ee7a6e82aac885c48f6e83526f0801793898",
                "sha2-256": "ffd9635befadb39718cabd8dbdd2f85ce1b7cce9cffc0b47f7554251d87b7deb"
            },
            "size": 7180648448
        }
    ]
}