{
    "osStr": "bridgeOS",
    "version": "5.4 beta",
    "build": "18P54646b",
    "restoreVersion": "18.16.14646.5.2,0",
    "buildId": "58E627E2-9C14-11EB-AD5D-BF571F136069",
    "buildTrain": "GoldenGateBridgeFSeed",
    "released": "2021-04-21",
    "beta": true,
    "deviceMap": [
        "iBridge2,1",
        "iBridge2,3",
        "iBridge2,4",
        "iBridge2,5",
        "iBridge2,6",
        "iBridge2,7",
        "iBridge2,8",
        "iBridge2,10",
        "iBridge2,12",
        "iBridge2,14",
        "iBridge2,15",
        "iBridge2,16",
        "iBridge2,19",
        "iBridge2,20",
        "iBridge2,21",
        "iBridge2,22"
    ],
    "sources": [
        {
            "type": "pkg",
            "systemImageId": "59157BF2-329E-4BFB-B6AA-AEA54CE19FB2",
            "deviceMap": [
                "iBridge2,1",
                "iBridge2,3",
                "iBridge2,4",
                "iBridge2,5",
                "iBridge2,6",
                "iBridge2,7",
                "iBridge2,8",
                "iBridge2,10",
                "iBridge2,12",
                "iBridge2,14",
                "iBridge2,15",
                "iBridge2,16",
                "iBridge2,19",
                "iBridge2,20",
                "iBridge2,21",
                "iBridge2,22"
            ],
            "links": [
                {
                    "url": "https://swcdn.apple.com/content/downloads/60/26/071-29401-A_BTAO0AKEJ3/8e68jv2nbeljac66e9r8r9oe3s60dddy30/BridgeOSUpdateCustomer.pkg",
                    "active": false
                }
            ],
            "size": 464929377
        }
    ]
}