{
    "osStr": "visionOS",
    "version": "1.3 beta 3",
    "build": "21O5761a",
    "restoreVersion": "21.15.761.5.1,0",
    "buildId": "DB40E8A8-378E-11EF-99EC-D327F2CC4AD1",
    "buildTrain": "BorealisGSeed",
    "released": "2024-07-09",
    "beta": true,
    "deviceMap": [
        "RealityDevice14,1"
    ],
    "sources": [
        {
            "type": "ipsw",
            "deviceMap": [
                "RealityDevice14,1"
            ],
            "links": [
                {
                    "url": "https://updates.cdn-apple.com/2024SpringSeed/fullrestores/062-28277/9AF374CC-6D65-4B59-9C60-FD69691D4AB6/Apple_Vision_Pro_1.3_21O5761a_Restore.ipsw",
                    "active": true
                }
            ],
            "hashes": {
                "sha1": "fd0f41beddef3f1369066405cd201ff0e166c6b8",
                "sha2-256": "02480bb499944763bc11dccdeaae51d7e04b14568b35c1ecf50a855b1641d053"
            },
            "size": 9187698657
        },
        {
            "type": "ota",
            "systemImageId": "A1B8D936-0385-4A25-A6E0-30EA74AC2705",
            "deviceMap": [
                "RealityDevice14,1"
            ],
            "links": [
                {
                    "url": "https://updates.cdn-apple.com/2024SpringSeed/patches/062-28281/AF732DE9-E2AE-4A34-A367-C948D47B677B/com_apple_MobileAsset_SoftwareUpdate/2f1c6a740965c75b5bec8f3ef98cb2d2782c5942.zip",
                    "active": true
                }
            ],
            "hashes": {
                "sha1": "8332c783eb70c459efde261577a7f056972ea9a8",
                "sha2-256": "4b80a675c71d0048bd7425f57491a35fef3fd2009614378d2bdb7b9c40f96c73"
            },
            "size": 7538272937
        },
        {
            "type": "ota",
            "prerequisiteBuild": "21O5587a",
            "systemImageId": "A1B8D936-0385-4A25-A6E0-30EA74AC2705",
            "deviceMap": [
                "RealityDevice14,1"
            ],
            "links": [
                {
                    "url": "https://updates.cdn-apple.com/2024SpringSeed/patches/062-28279/17D4A1DD-DCB6-4B71-83E3-50136BCEBBF8/com_apple_MobileAsset_SoftwareUpdate/2e25726f98a2359f81c58efc7b637d3c2c93a96b.zip",
                    "active": true
                }
            ],
            "hashes": {
                "sha1": "20877e7b945ae7a2dbeb1696130c20d2070250ab",
                "sha2-256": "e0baa9d3c598a70344a00071beb25344e95eb2a191d7cb9fabfae61cf5ce63ac"
            },
            "size": 1414257788
        },
        {
            "type": "ota",
            "prerequisiteBuild": "21O5756a",
            "systemImageId": "A1B8D936-0385-4A25-A6E0-30EA74AC2705",
            "deviceMap": [
                "RealityDevice14,1"
            ],
            "links": [
                {
                    "url": "https://updates.cdn-apple.com/2024SpringSeed/patches/062-28734/DB8017DD-826A-4EC2-B29D-A49C0CD8DA6B/com_apple_MobileAsset_SoftwareUpdate/21a964ca852941ebc7c54a6f225f4bf166d110d8.zip",
                    "active": true
                }
            ],
            "hashes": {
                "sha1": "e7d3f116913bd90a67af3fe13583cd3b3268c6bc",
                "sha2-256": "6e29c1bc6a94bdf091553ed70e4443800b9496d792df236c8ed390745a35f14c"
            },
            "size": 668616020
        },
        {
            "type": "recovery",
            "systemImageId": "3C15130B-7EE4-4425-81EB-27448B56DD97",
            "deviceMap": [
                "RealityDevice14,1"
            ],
            "links": [
                {
                    "url": "https://updates.cdn-apple.com/2024SpringSeed/patches/062-28278/3BA6AB2E-C9C0-4A83-8DF2-2996BC3CE7ED/com_apple_MobileAsset_RecoveryOSUpdate/38a3553014272421168a0a1e178403cdea27b210.zip",
                    "active": true
                }
            ],
            "hashes": {
                "sha1": "0b1622353a2d5f4a7a51c067840e807774009392",
                "sha2-256": "92e043e9167d8c9d29a6341cb9391210d91ea3cd89d047fd803999bd91e00bf3"
            },
            "size": 194258088
        }
    ]
}